{
  "cv_file_url": "https://example.supabase.co/storage/v1/object/public/cvs/camila-santos.pdf",
  "titulo_declarado_hoje": "Operations Manager",
  "titulo_usado_ultimos_6_meses": "Project Manager",
  "pais_prioridade_1": "Alemanha",
  "motivo_prioridade_1": "Quero entrar em um mercado industrial mais estruturado, com trajetoria de medio prazo e leitura forte de experiencia tecnica.",
  "onde_investe_tempo_dinheiro_4_semanas": "Aulas de alemao B1, revisao de CV em ingles e aplicacoes para vagas na Alemanha.",
  "prova_publica_existente": "https://linkedin.com/in/camila-santos",
  "vaga_referencia_real": "Senior Operations Manager, Munich, Germany",
  "reserva_financeira_meses": 8,
  "tem_familia_dependentes": true,
  "contexto_familia": "Casada, sem filhos, com cônjuge disposto a mudar junto.",
  "outras_cidadanias_ascendencia": null,
  "situacao_visto_atual": "Sem visto europeu. Precisa de patrocinio ou rota viavel de entrada.",
  "flexibilidade_cidade": "aberto",
  "cidade_especifica": null,
  "meta_salarial_minima": 65000,
  "meta_salarial_alvo": 80000,
  "moeda": "EUR"
}
